{
  "$schema": "https://json-schema.org/draft/2020-12/schema",
  "$id": "schemas/governance/slge_sdlc_g0_runtime.schema.json",
  "title": "SLGE-SDLC-G0 Repository and PR Enforcement Runtime Contract",
  "type": "object",
  "required": [
    "version",
    "contract_version",
    "branch_ref",
    "predecessor_slot_ref",
    "next_slot_ref",
    "origin_refs",
    "runtime_ref",
    "projection_ref",
    "transition_contract_ref",
    "operation",
    "required_inputs",
    "allowed_changed_paths",
    "required_declarations",
    "authority_ceiling",
    "rank_ceiling",
    "residual_policy",
    "trace_policy",
    "forbidden_outputs",
    "failure_codes"
  ],
  "properties": {
    "version": { "type": "string", "minLength": 1 },
    "contract_version": { "const": "SLGE-SDLC-G0.v1" },
    "branch_ref": { "const": "SLGE-SDLC-G0" },
    "predecessor_slot_ref": { "const": "SLGE-SDLC-P0" },
    "next_slot_ref": { "const": "SLGE-SDLC-C0" },
    "origin_refs": {
      "type": "array",
      "items": { "type": "string", "minLength": 1 },
      "minItems": 1,
      "uniqueItems": true
    },
    "runtime_ref": { "type": "string", "minLength": 1 },
    "projection_ref": { "type": "string", "minLength": 1 },
    "transition_contract_ref": { "const": "TX-SLGE-P0-TO-G0-001" },
    "operation": { "const": "EnforceLifecycleDeclarations" },
    "required_inputs": {
      "const": ["LifecycleProjection", "EnforcementContracts"]
    },
    "allowed_changed_paths": {
      "const": [
        ".github/workflows/ci.yml",
        "docs/129_SLGE_SDLC_G0_REPOSITORY_AND_PR_ENFORCEMENT.md",
        "docs/14_PR_CHAIN_ROADMAP.md",
        "docs/README.md",
        "governance/history/amendments.jsonl",
        "governance/projections/current_state.json",
        "governance/projections/slge_sdlc_current_lifecycle_state.json",
        "governance/registry/artifacts.json",
        "governance/registry/branches.json",
        "governance/registry/dependencies.json",
        "governance/registry/evidence_map.json",
        "governance/registry/projection_inputs.json",
        "governance/registry/residuals.json",
        "governance/registry/runtime_map.json",
        "governance/registry/slge_sdlc_g0_runtime.json",
        "governance/registry/slge_sdlc_p0_lifecycle_events.json",
        "schemas/governance/slge_sdlc_g0_runtime.schema.json",
        "src/taaqqul_slot_geometry/governance/__init__.py",
        "src/taaqqul_slot_geometry/governance/slge_sdlc_e0_runtime.py",
        "src/taaqqul_slot_geometry/governance/slge_sdlc_g0_enforcement.py",
        "tests/test_slge_sdlc_e0_runtime.py",
        "tests/test_slge_sdlc_g0_runtime.py",
        "tests/test_slge_sdlc_p0_projection.py"
      ]
    },
    "required_declarations": {
      "type": "array",
      "items": { "type": "string", "minLength": 1 },
      "minItems": 1,
      "uniqueItems": true
    },
    "authority_ceiling": { "const": "RuntimeAuthority" },
    "rank_ceiling": { "const": "E1" },
    "residual_policy": {
      "type": "object",
      "required": ["resolved", "remains_open"],
      "properties": {
        "resolved": { "const": ["SLGE_G0_PR_ENFORCEMENT_PENDING"] },
        "remains_open": { "const": ["SLGE_C0_CLOSURE_AUDIT_PENDING"] }
      },
      "additionalProperties": false
    },
    "trace_policy": { "type": "string", "minLength": 1 },
    "forbidden_outputs": {
      "type": "array",
      "items": { "type": "string", "minLength": 1 },
      "minItems": 1,
      "uniqueItems": true
    },
    "failure_codes": {
      "type": "array",
      "items": { "type": "string", "minLength": 1 },
      "minItems": 1,
      "uniqueItems": true
    },
    "lanes": {
      "type": "object",
      "description": "Bounded evidence lanes inside G0 (Amendment-108). A lane never opens a successor, changes rank or authority, or mutates the lifecycle projection.",
      "propertyNames": { "pattern": "^[A-Z0-9]+(-[A-Z0-9]+)*$" },
      "additionalProperties": {
        "type": "object",
        "required": [
          "amendment_ref",
          "description",
          "allowed_path_globs",
          "forbidden_path_prefixes",
          "required_declarations",
          "required_evidence_refs",
          "decision_effects",
          "forbidden_outputs",
          "failure_codes"
        ],
        "properties": {
          "amendment_ref": { "type": "string", "minLength": 1 },
          "description": { "type": "string", "minLength": 1 },
          "allowed_path_globs": {
            "type": "array",
            "items": { "type": "string", "minLength": 1 },
            "minItems": 1,
            "uniqueItems": true
          },
          "forbidden_path_prefixes": {
            "type": "array",
            "items": { "type": "string", "minLength": 1 },
            "minItems": 1,
            "uniqueItems": true
          },
          "required_declarations": {
            "type": "array",
            "items": { "type": "string", "minLength": 1 },
            "minItems": 1,
            "uniqueItems": true
          },
          "required_evidence_refs": {
            "type": "array",
            "items": { "type": "string", "minLength": 1 },
            "minItems": 1,
            "uniqueItems": true
          },
          "decision_effects": {
            "type": "object",
            "required": [
              "opens_successor",
              "rank_change",
              "authority_change",
              "resolves_residuals",
              "adds_residuals"
            ],
            "properties": {
              "opens_successor": { "const": false },
              "rank_change": { "const": "none" },
              "authority_change": { "const": "none" },
              "resolves_residuals": { "const": [] },
              "adds_residuals": {
                "type": "array",
                "items": { "type": "string", "minLength": 1 },
                "uniqueItems": true
              }
            },
            "additionalProperties": false
          },
          "forbidden_outputs": {
            "type": "array",
            "items": { "type": "string", "minLength": 1 },
            "minItems": 1,
            "uniqueItems": true
          },
          "failure_codes": {
            "type": "array",
            "items": { "type": "string", "minLength": 1 },
            "minItems": 1,
            "uniqueItems": true
          }
        },
        "additionalProperties": false
      }
    }
  },
  "additionalProperties": false
}
