{
  "version": "1.1.0",
  "contract_version": "SLGE-SDLC-G0.v1",
  "branch_ref": "SLGE-SDLC-G0",
  "predecessor_slot_ref": "SLGE-SDLC-P0",
  "next_slot_ref": "SLGE-SDLC-C0",
  "origin_refs": [
    "docs/124_SLOT_LICENSED_GEOMETRICAL_ENGINEERING_PROJECT_DEVELOPMENT_LIFECYCLE_CONSTITUTION.md",
    "docs/127_SLGE_SDLC_E0_LIFECYCLE_EXECUTION_ENGINE.md",
    "docs/128_SLGE_SDLC_P0_DETERMINISTIC_LIFECYCLE_PROJECTION.md",
    "docs/129_SLGE_SDLC_G0_REPOSITORY_AND_PR_ENFORCEMENT.md",
    "docs/14_PR_CHAIN_ROADMAP.md"
  ],
  "runtime_ref": "src/taaqqul_slot_geometry/governance/slge_sdlc_g0_enforcement.py",
  "projection_ref": "governance/projections/slge_sdlc_current_lifecycle_state.json",
  "transition_contract_ref": "TX-SLGE-P0-TO-G0-001",
  "operation": "EnforceLifecycleDeclarations",
  "required_inputs": [
    "LifecycleProjection",
    "EnforcementContracts"
  ],
  "allowed_changed_paths": [
    ".github/workflows/ci.yml",
    "docs/129_SLGE_SDLC_G0_REPOSITORY_AND_PR_ENFORCEMENT.md",
    "docs/14_PR_CHAIN_ROADMAP.md",
    "docs/README.md",
    "governance/history/amendments.jsonl",
    "governance/projections/current_state.json",
    "governance/projections/slge_sdlc_current_lifecycle_state.json",
    "governance/registry/artifacts.json",
    "governance/registry/branches.json",
    "governance/registry/dependencies.json",
    "governance/registry/evidence_map.json",
    "governance/registry/projection_inputs.json",
    "governance/registry/residuals.json",
    "governance/registry/runtime_map.json",
    "governance/registry/slge_sdlc_g0_runtime.json",
    "governance/registry/slge_sdlc_p0_lifecycle_events.json",
    "schemas/governance/slge_sdlc_g0_runtime.schema.json",
    "src/taaqqul_slot_geometry/governance/__init__.py",
    "src/taaqqul_slot_geometry/governance/slge_sdlc_e0_runtime.py",
    "src/taaqqul_slot_geometry/governance/slge_sdlc_g0_enforcement.py",
    "tests/test_slge_sdlc_e0_runtime.py",
    "tests/test_slge_sdlc_g0_runtime.py",
    "tests/test_slge_sdlc_p0_projection.py"
  ],
  "required_declarations": [
    "OriginLaw",
    "Branch",
    "ChainPosition",
    "AllowedScope",
    "ForbiddenScope",
    "OutputBoundary",
    "ConstitutionalTests",
    "NegativeTests",
    "ResidualsAfterMerge"
  ],
  "authority_ceiling": "RuntimeAuthority",
  "rank_ceiling": "E1",
  "residual_policy": {
    "resolved": [
      "SLGE_G0_PR_ENFORCEMENT_PENDING"
    ],
    "remains_open": [
      "SLGE_C0_CLOSURE_AUDIT_PENDING"
    ]
  },
  "trace_policy": "Bind PR declarations and evidence paths to the reducer-derived G0 transition decision.",
  "forbidden_outputs": [
    "ClosureClaim",
    "SLGE-SDLC-C0",
    "SpellingBridge",
    "CountingRuntime",
    "MorphologyRuntime",
    "ArabicLicensing",
    "V1ClosedClaim"
  ],
  "failure_codes": [
    "TRANSITION_NOT_LICENSED",
    "EVIDENCE_INSUFFICIENT",
    "TRACE_LOSS",
    "GATE_NOT_APPROVED",
    "BACKWARD_PROOF_FAILED",
    "FORWARD_READINESS_FAILED",
    "TRIANGLE_COHERENCE_FAILED"
  ],
  "lanes": {
    "PROOF-EVIDENCE-L1": {
      "amendment_ref": "Amendment-108",
      "description": "Formal-proof evidence lane inside SLGE-SDLC-G0: admits the Lean proof package under proofs/arabic as evidence only; it opens no successor, changes no rank or authority, and licenses no runtime bridge.",
      "allowed_path_globs": [
        "proofs/arabic/**",
        ".github/workflows/arabic-proof.yml",
        "governance/registry/evidence_map.json",
        "governance/registry/residuals.json",
        "governance/history/amendments.jsonl",
        "docs/14_PR_CHAIN_ROADMAP.md"
      ],
      "forbidden_path_prefixes": [
        "src/",
        "tests/",
        "schemas/",
        "governance/registry/slge_sdlc_g0_runtime.json",
        "governance/projections/",
        ".github/workflows/ci.yml",
        "docs/129_SLGE_SDLC_G0_REPOSITORY_AND_PR_ENFORCEMENT.md",
        "weight/",
        "runtime/",
        "lge/",
        "x0r/"
      ],
      "required_declarations": [
        "OriginLaw",
        "Branch",
        "ChainPosition",
        "AllowedScope",
        "ForbiddenScope",
        "OutputBoundary",
        "ConstitutionalTests",
        "NegativeTests",
        "ResidualsAfterMerge",
        "Lane",
        "ProofPackageCheck"
      ],
      "required_evidence_refs": [
        "proofs/arabic/rules.json",
        "proofs/arabic/check.sh",
        "proofs/arabic/README_AR.md"
      ],
      "decision_effects": {
        "opens_successor": false,
        "rank_change": "none",
        "authority_change": "none",
        "resolves_residuals": [],
        "adds_residuals": [
          "ARABIC_PROOF_RUNTIME_BRIDGE_PENDING"
        ]
      },
      "forbidden_outputs": [
        "ClosureClaim",
        "SLGE-SDLC-C0",
        "SpellingBridge",
        "CountingRuntime",
        "MorphologyRuntime",
        "ArabicLicensing",
        "V1ClosedClaim"
      ],
      "failure_codes": [
        "LANE_NOT_REGISTERED",
        "LANE_SCOPE_VIOLATION",
        "LANE_DECLARATION_MISSING",
        "LANE_STAGE_INCONSISTENT",
        "LANE_EVIDENCE_INSUFFICIENT",
        "LANE_OUTPUT_BOUNDARY_VIOLATION",
        "LANE_RESIDUAL_POLICY_VIOLATION",
        "LANE_TRACE_LOSS"
      ]
    }
  }
}
